b0b5f454-ad2c-47f7-a187-5dd31d1f205b,"Intel E5-2690 v4 2.6GHz,35M Cache,9.60GT/s 14C/28T (135W) - Designed for software defined infrastructure supercharged for efficiency, performance, and agile services delivery across cloud-native and traditional applications.","#N/A","#N/A",Hardware,true,Intel E5-2690 v4 2.6GHz,INTEL E5-2690,"#N/A",Allow Refund,One per quote line,"#N/A","#N/A","#N/A",Quantity,One-Time,true,"#N/A","#N/A","#N/A","#N/A","#N/A",Disabled,"#N/A","#N/A","#N/A",false,"#N/A",false,"#N/A","#N/A",1.0,false,"#N/A",false,false,false,false,Do Not Generate,false,false,false,false,false,false,false,false,Tabs,Click,false,false,false,List,"#N/A",true,"#N/A",false,"#N/A","#N/A",List,"#N/A","#N/A","#N/A","#N/A",One-time,"#N/A",false,"#N/A","#N/A","#N/A"
b282ddaf-97da-49b8-bc8e-71235fd77466,"Occupying 1U of rack space, this shelf provides ventilation, 4-post mounting and an adjustable mounting depth.","#N/A","#N/A",Hardware,true,Fixed Shelf 250lbs,BSSA-4302,"#N/A",Allow Refund,One per quote line,"#N/A","#N/A","#N/A",Quantity,One-Time,true,"#N/A","#N/A","#N/A","#N/A","#N/A",Disabled,"#N/A","#N/A","#N/A",false,"#N/A",false,"#N/A","#N/A",1.0,false,"#N/A",false,false,false,false,"#N/A",false,false,false,false,true,false,false,false,Tabs,Click,false,false,false,List,"#N/A",true,"#N/A",false,"#N/A","#N/A",List,Hardware,"#N/A","#N/A","#N/A",One-time,"#N/A",false,"#N/A","#N/A","#N/A"
b4684c46-3a01-49dd-9e2a-09eeb2a1d3e9,"Rack PDU 15A, 120V L5-20 input 5-20 output - Basic Rack Power Distribution Unit allows users to distribute power outlets to rack-mount equipment.","#N/A","#N/A",Hardware,true,"Rack PDU 15A, 120V L5-20",PDU-2024,"#N/A",Allow Refund,One per quote line,"#N/A","#N/A","#N/A",Quantity,One-Time,true,"#N/A","#N/A","#N/A","#N/A","#N/A",Disabled,"#N/A","#N/A","#N/A",false,"#N/A",false,"#N/A","#N/A",1.0,false,"#N/A",false,false,false,false,"#N/A",false,false,false,false,true,false,false,false,Tabs,Click,false,false,false,List,"#N/A",true,"#N/A",false,"#N/A","#N/A",List,Hardware,"#N/A","#N/A","#N/A",One-time,"#N/A",false,"#N/A","#N/A","#N/A"
b5128a3b-3f19-4142-ab57-4991ab302898,"Rack PDU 30A, 120V L5-20 input 5-20 output - Basic Rack Power Distribution Unit allows users to distribute power outlets to rack-mount equipment.","#N/A","#N/A",Hardware,true,"Rack PDU 30A, 120V L5-20",PDU-2023,"#N/A",Allow Refund,One per quote line,"#N/A","#N/A","#N/A",Quantity,One-Time,true,"#N/A","#N/A","#N/A","#N/A","#N/A",Disabled,"#N/A","#N/A","#N/A",false,"#N/A",false,"#N/A","#N/A",1.0,false,"#N/A",false,false,false,false,"#N/A",false,false,false,false,true,false,false,false,Tabs,Click,false,false,false,List,"#N/A",true,"#N/A",false,"#N/A","#N/A",List,Hardware,"#N/A","#N/A","#N/A",One-time,"#N/A",false,"#N/A","#N/A","#N/A"
b7e9717f-b35d-4d28-a913-64072331e947,"Enterprise Log Manager collects, compresses, signs, and stores all original events with a clear audit trail of activity that can't be repudiated.","#N/A","#N/A",Software,true,Enterprise Log Manager,SIEM-004,"#N/A",Default,One per quote line,"#N/A",Monthly,Arrears,Quantity,Recurring,false,"#N/A","#N/A","#N/A","#N/A","#N/A","#N/A","#N/A","#N/A","#N/A",false,"#N/A",false,"#N/A","#N/A",1.0,false,"#N/A",false,false,false,false,"#N/A",false,false,false,false,false,false,false,false,"#N/A",Click,false,false,false,List,"#N/A",true,"#N/A",false,"#N/A","#N/A",List,"#N/A","#N/A",Fixed Price,1.0,Renewable,"#N/A",false,"#N/A","#N/A","#N/A"
b9a50c51-fd51-461d-abc1-2f9550c2b8b7,Cloud Threat Detection is a convenient service that plugs into existing Atomic security solutions to detect advanced malware.,"#N/A","#N/A",Software,true,Cloud Threat Detection,ATA-001,"#N/A",Default,One per quote line,"#N/A",Monthly,Arrears,Quantity,Recurring,false,"#N/A","#N/A","#N/A","#N/A","#N/A","#N/A","#N/A","#N/A","#N/A",false,"#N/A",false,"#N/A","#N/A",1.0,false,"#N/A",false,false,false,false,"#N/A",false,false,false,false,false,false,false,false,"#N/A",Click,false,false,false,List,"#N/A",true,"#N/A",false,"#N/A","#N/A",List,"#N/A","#N/A",Fixed Price,1.0,Renewable,"#N/A",false,"#N/A","#N/A","#N/A"
ba1b79a1-89ee-4579-98bc-cbcfacc30e44,"Security for Email Servers provides award-winning in-memory and incremental on-demand scanning to remove viruses, worms, Trojans, phishing, and other threats from incoming and outgoing email.","#N/A","#N/A",Software,true,Security for Email Servers,AS-001,"#N/A",Default,One per quote line,"#N/A",Monthly,Arrears,Quantity,Recurring,false,"#N/A","#N/A","#N/A","#N/A","#N/A","#N/A","#N/A","#N/A","#N/A",false,"#N/A",false,"#N/A","#N/A",1.0,false,"#N/A",false,false,false,false,"#N/A",false,false,false,false,false,false,false,false,"#N/A",Click,false,false,false,List,"#N/A",true,"#N/A",false,"#N/A","#N/A",List,"#N/A","#N/A",Fixed Price,1.0,Renewable,"#N/A",false,"#N/A","#N/A","#N/A"
ba60d734-0d95-4d50-946f-f882db743b2a,"System maintenance, administration, and configuration performed by a certified technician. Also includes 24x7 phone service and monthly on-site check-ups. 20% of hardware.","#N/A","#N/A",Services,true,Gold Hardware Maintenance,SUPP-1005,"#N/A",Default,One per quote line,"#N/A",Annual,Advance,Quantity,Recurring,true,"#N/A","#N/A","#N/A","#N/A","#N/A",Disabled,"#N/A","#N/A","#N/A",false,"#N/A",false,"#N/A","#N/A",1.0,false,"#N/A",false,false,false,false,"#N/A",false,false,false,false,false,false,true,false,Tabs,Click,false,false,false,List,"#N/A",true,"#N/A",false,"#N/A","#N/A",Net,Hardware,20.0,Percent Of Total,12.0,Renewable,"#N/A",false,"#N/A","#N/A","#N/A"
baae069e-407b-4705-b9ba-ecfcc9f1949c,"MaxShell cooling, power distribution, and cable management products work seamlessly with IT enclosures to provide a complete infrastructure support system.  Holds 10 rack units (U's) for a vertical storage rack.","#N/A","#N/A",Hardware,true,MaxShell 10U 600mmx1200mm,BMX-1053,"#N/A",Allow Refund,One per quote line,"#N/A","#N/A","#N/A",Quantity,One-Time,true,"#N/A","#N/A","#N/A","#N/A","#N/A",Disabled,"#N/A","#N/A","#N/A",false,"#N/A",false,"#N/A","#N/A",1.0,false,"#N/A",false,false,false,false,"#N/A",false,false,false,false,true,false,false,false,Tabs,Click,false,false,false,List,"#N/A",true,"#N/A",false,"#N/A","#N/A",List,Hardware,"#N/A","#N/A","#N/A",One-time,"#N/A",false,"#N/A","#N/A","#N/A"
bd511fb0-8474-4738-bbcc-643ab06b5201,Rack PDU 16A 230V C20 input C13 output - Basic Rack Power Distribution Unit allows users to distribute power outlets to rack-mount equipment.,"#N/A","#N/A",Hardware,true,"Rack PDU 16A, 230V, C13 output",PDU-2027,"#N/A",Allow Refund,One per quote line,"#N/A","#N/A","#N/A",Quantity,One-Time,true,"#N/A","#N/A","#N/A","#N/A","#N/A",Disabled,"#N/A","#N/A","#N/A",false,"#N/A",false,"#N/A","#N/A",1.0,false,"#N/A",false,false,false,false,"#N/A",false,false,false,false,true,false,false,false,Tabs,Click,false,false,false,List,"#N/A",true,"#N/A",false,"#N/A","#N/A",List,Hardware,"#N/A","#N/A","#N/A",One-time,"#N/A",false,"#N/A","#N/A","#N/A"
bf4a511c-55fa-4600-ba7f-1b378e589f89,Online Single Sign On training for end users includes education and certification modules. Annual Subscription.,"#N/A","#N/A",Services,true,SSO Training Portal for End Users,S-SSO-UTP,"#N/A",Default,One per quote line,"#N/A",Annual,Advance,Quantity,Recurring,false,"#N/A","#N/A","#N/A","#N/A","#N/A","#N/A","#N/A","#N/A","#N/A",false,"#N/A",false,"#N/A",Standard,1.0,false,"#N/A",false,false,false,false,"#N/A",false,false,false,false,false,false,false,false,"#N/A",Click,false,false,false,List,"#N/A",true,"#N/A",false,"#N/A","#N/A",List,"#N/A","#N/A",Fixed Price,12.0,Renewable,"#N/A",false,"#N/A","#N/A","#N/A"
bf99b89f-dca2-44a2-b330-1bb92eaade17,"Module that enables the export of your Single Sign On data to Access, Excel, and JDBC Databases.","#N/A","#N/A",Software,true,Report Exporting Tools,S-SSO-REPX,"#N/A",Default,One per quote line,"#N/A",Annual,Advance,Quantity,Recurring,false,"#N/A","#N/A","#N/A","#N/A","#N/A","#N/A","#N/A","#N/A","#N/A",false,"#N/A",false,"#N/A","#N/A",1.0,false,"#N/A",false,false,false,false,"#N/A",false,false,false,false,false,false,false,false,"#N/A",Click,false,false,false,List,"#N/A",true,"#N/A",false,"#N/A","#N/A",List,"#N/A","#N/A",Fixed Price,12.0,Renewable,"#N/A",false,"#N/A","#N/A","#N/A"
c04fa045-c1eb-47b5-9522-13cca722feae,"Our certified Module Extension Engineers specialize in configuring and customizing the additional modules to a client's specifications, and work closely with the Core System Engineers.","#N/A","#N/A",Services,true,Module Extension Engineer,SV-MEE,"#N/A",Default,One per quote line,"#N/A","#N/A","#N/A",Quantity,One-Time,true,"#N/A","#N/A","#N/A","#N/A","#N/A","#N/A","#N/A","#N/A","#N/A",false,"#N/A",false,"#N/A","#N/A",1.0,false,"#N/A",false,false,false,false,"#N/A",false,false,false,false,false,false,false,false,"#N/A",Click,false,false,false,List,"#N/A",true,"#N/A",false,"#N/A","#N/A",List,"#N/A","#N/A","#N/A","#N/A",Renewable,"#N/A",false,"#N/A","#N/A","#N/A"
c1bc94eb-039d-4591-ba4b-8ad9123487c8,"Our certified Module Extension Engineers specialize in configuring and customizing the additional modules to a clients specifications, and work closely with the Core System Engineers.","#N/A","#N/A",Services,true,Module Extension Engineer,SV-MEE,"#N/A",Default,One per quote line,"#N/A","#N/A","#N/A",Quantity,One-Time,false,"#N/A","#N/A","#N/A","#N/A","#N/A","#N/A","#N/A","#N/A","#N/A",false,"#N/A",false,"#N/A","#N/A",1.0,false,"#N/A",false,false,false,false,"#N/A",false,false,false,false,false,false,true,false,"#N/A",Click,false,false,false,List,"#N/A",true,"#N/A",false,"#N/A","#N/A",List,"#N/A","#N/A","#N/A","#N/A",Renewable,"#N/A",false,"#N/A","#N/A","#N/A"
c28e9941-8609-4c51-b221-cd01a5f823de,Roof Fan Tray promotes bottom to top airflow for an enclosure in zero U of space. It cools by exhausting heat out of the roof of the rack.,"#N/A","#N/A",Hardware,true,Roof Fan Tray 750mm - 120V,BSSA-4306,"#N/A",Allow Refund,One per quote line,"#N/A","#N/A","#N/A",Quantity,One-Time,true,"#N/A","#N/A","#N/A","#N/A","#N/A",Disabled,"#N/A","#N/A","#N/A",false,"#N/A",false,"#N/A","#N/A",1.0,false,"#N/A",false,false,false,false,"#N/A",false,false,false,false,true,false,false,false,Tabs,Click,false,false,false,List,"#N/A",true,"#N/A",false,"#N/A","#N/A",List,Hardware,"#N/A","#N/A","#N/A",One-time,"#N/A",false,"#N/A","#N/A","#N/A"
c29bc6d8-dbfc-45ce-bf55-a096ba430d1c,"Intel Xeon E5-2660 v4 2.0GHz,35M Cache,9.60GT/s QPI,Turbo,HT,14C/28T (105W) - Designed for software defined infrastructure supercharged for efficiency, performance, and agile services delivery across cloud-native and traditional applications.","#N/A","#N/A",Hardware,true,Intel Xeon E5-2660 v4 2.0GHz,INTEL E5-2660,"#N/A",Allow Refund,One per quote line,"#N/A","#N/A","#N/A",Quantity,One-Time,true,"#N/A","#N/A","#N/A","#N/A","#N/A",Disabled,"#N/A","#N/A","#N/A",false,"#N/A",false,"#N/A","#N/A",1.0,false,"#N/A",false,false,false,false,Do Not Generate,false,false,false,false,true,false,false,false,Tabs,Click,false,false,false,List,"#N/A",true,"#N/A",false,"#N/A","#N/A",List,Hardware,"#N/A","#N/A","#N/A",One-time,"#N/A",false,"#N/A","#N/A","#N/A"
c57dfb20-92df-4778-b6a5-f61822e55df4,"Security Suite for Virtual Desktop Infrastructure (VDI) offers Cloud Workload Discovery for private cloud deployments, covering VMware and OpenStack, for end-to-end visibility into all workloads and their underlying platforms.","#N/A","#N/A",Software,true,Security Suite,SS-008,"#N/A",Default,One per quote line,"#N/A",Monthly,Arrears,Quantity,Recurring,false,"#N/A","#N/A","#N/A","#N/A","#N/A","#N/A","#N/A","#N/A","#N/A",false,"#N/A",false,"#N/A","#N/A",1.0,false,"#N/A",false,false,false,false,"#N/A",false,false,false,false,false,false,false,false,"#N/A",Click,false,false,false,List,"#N/A",true,"#N/A",false,"#N/A","#N/A",List,OnPremise,"#N/A",Fixed Price,1.0,"#N/A","#N/A",false,"#N/A","#N/A","#N/A"
c682209d-df4c-4bb0-97ca-7650bd72e350,Generalist for Atomic Security Suite Deployments,"#N/A","#N/A",Services,true,Business Analyst,SRVR-002,"#N/A",Default,"#N/A","#N/A","#N/A","#N/A",Quantity,One-Time,false,"#N/A","#N/A","#N/A","#N/A","#N/A","#N/A","#N/A","#N/A","#N/A",false,"#N/A",false,"#N/A",Standard,1.0,false,"#N/A",false,false,false,false,"#N/A",false,false,false,false,false,false,false,false,"#N/A",Click,false,false,false,List,"#N/A",true,"#N/A",false,"#N/A","#N/A",List,"#N/A","#N/A","#N/A","#N/A",Renewable,"#N/A",false,"#N/A","#N/A","#N/A"
c6ae13db-f3fe-4d6f-b96f-8f6ac1d495a0,"#N/A","#N/A","#N/A",Software,true,Embedded Control,EP-002,"#N/A",Default,One per quote line,"#N/A",Monthly,Arrears,Quantity,Recurring,false,"#N/A","#N/A","#N/A","#N/A","#N/A","#N/A","#N/A","#N/A","#N/A",false,"#N/A",false,"#N/A",Standard,1.0,false,"#N/A",false,false,false,false,"#N/A",false,false,false,false,true,false,false,false,"#N/A",Click,false,false,false,List,"#N/A",true,"#N/A",false,"#N/A","#N/A",List,"#N/A","#N/A",Fixed Price,1.0,Renewable,"#N/A",false,"#N/A","#N/A","#N/A"
c73b56fa-8be3-4335-b185-ae0be5341072,The Power Cord is designed to provide ideal electrical connectivity to your equipments. It operates at 250-Volt voltage range.,"#N/A","#N/A",Hardware,true,C13 to C14 Power Cable 5',CMPC-5888,"#N/A",Allow Refund,One per quote line,"#N/A","#N/A","#N/A",Quantity,One-Time,true,"#N/A","#N/A","#N/A","#N/A","#N/A",Disabled,"#N/A","#N/A","#N/A",false,"#N/A",false,"#N/A","#N/A",1.0,false,"#N/A",false,false,false,false,"#N/A",false,false,false,false,true,false,false,false,Tabs,Click,false,false,false,List,"#N/A",true,"#N/A",false,"#N/A","#N/A",List,Hardware,"#N/A","#N/A","#N/A",One-time,"#N/A",false,"#N/A","#N/A","#N/A"
c74f4da8-9d28-4498-9868-922652c7177f,"The Project Manager ensures a projects timely and efficient delivery by coordinating meetings, tracking progress, escalating issues, and proctoring weekly status reports.","#N/A","#N/A",Services,true,Project Manager,SV-PMN,"#N/A",Default,One per quote line,"#N/A","#N/A","#N/A",Quantity,One-Time,false,"#N/A","#N/A","#N/A","#N/A","#N/A","#N/A","#N/A","#N/A","#N/A",false,"#N/A",false,"#N/A","#N/A",1.0,false,"#N/A",false,false,false,false,"#N/A",false,false,false,false,false,false,true,false,"#N/A",Click,false,false,false,List,"#N/A",true,"#N/A",false,"#N/A","#N/A",List,"#N/A","#N/A","#N/A","#N/A",Renewable,"#N/A",false,"#N/A","#N/A","#N/A"
c9cf10dc-1062-4e3d-9057-ecbf2102abad,"The PowerSlide server is designed to bring excellent performance, expandability and deployment flexibility to organizations that must deploy multiple integrated servers in a minimum amount of space at a low cost.","#N/A","#N/A",Hardware,true,PowerSlide R750 Rack Server,PS-R750,"#N/A",Allow Refund,One per quote line,"#N/A","#N/A","#N/A",Quantity,One-Time,false,"#N/A",Always,"#N/A","#N/A","#N/A",Allowed,"#N/A",PS-R-{1}{2}{3}{4},"#N/A",false,"#N/A",false,"#N/A","#N/A",1.0,false,"#N/A",false,false,false,false,"#N/A",true,false,false,false,true,false,false,false,Tabs,Click,false,false,false,List,"#N/A",true,"#N/A",false,"#N/A","#N/A",List,Hardware,"#N/A","#N/A","#N/A",One-time,"#N/A",false,"#N/A","#N/A","#N/A"
cc607c6b-14e7-4a7c-8f6a-f2e82ee6280c,"Global Threat Intelligence  (GTI) for Enterprise Security Manager delivers a constantly updated, rich feed that enables rapid discovery of events involving communications with suspicious or malicious IP addresses.","#N/A","#N/A",Software,true,Global Threat Intelligence for ESM,SIEM-007,"#N/A",Default,One per quote line,"#N/A",Annual,Arrears,Quantity,Recurring,false,"#N/A","#N/A","#N/A","#N/A","#N/A","#N/A","#N/A","#N/A","#N/A",false,"#N/A",false,"#N/A","#N/A",1.0,false,"#N/A",false,false,false,false,"#N/A",false,false,false,false,false,false,false,false,"#N/A",Click,false,false,false,List,"#N/A",true,"#N/A",false,"#N/A","#N/A",List,"#N/A","#N/A",Fixed Price,12.0,Renewable,"#N/A",false,"#N/A","#N/A","#N/A"
cd79c2bd-4028-4847-8fc0-8fdf500ce4d4,SLA Credit,"#N/A","#N/A","#N/A",true,SLA Credit,sla-credit,"#N/A",Default,One per quote line,"#N/A","#N/A","#N/A",Quantity,One-Time,true,"#N/A","#N/A","#N/A","#N/A","#N/A","#N/A","#N/A","#N/A","#N/A",false,"#N/A",false,"#N/A","#N/A",1.0,false,"#N/A",false,false,false,false,"#N/A",false,false,false,false,false,false,false,false,"#N/A",Click,false,true,false,List,"#N/A",true,"#N/A",false,"#N/A","#N/A",List,"#N/A","#N/A","#N/A","#N/A",Renewable,"#N/A",false,"#N/A","#N/A","#N/A"
cda34c33-0394-4eec-ba32-b551bba59ff4,"Web Protection uses secure web gateway technology to protect every device, user, and location from sophisticated internet threats.","#N/A","#N/A",Software,true,Web Protection,WS-003,"#N/A",Default,One per quote line,"#N/A",Monthly,Arrears,Quantity,Recurring,false,"#N/A","#N/A","#N/A","#N/A","#N/A","#N/A","#N/A","#N/A","#N/A",false,"#N/A",false,"#N/A","#N/A",1.0,false,"#N/A",false,false,false,false,"#N/A",false,false,false,false,false,false,false,false,"#N/A",Click,false,false,false,List,"#N/A",true,"#N/A",false,"#N/A","#N/A",List,"#N/A","#N/A",Fixed Price,1.0,Renewable,"#N/A",false,"#N/A","#N/A","#N/A"
cee6c182-5fc9-4305-87ca-eaaa1ca8d6e2,"#N/A","#N/A","#N/A",Software,true,Threat Intelligence Exchange,SM-002,"#N/A",Default,One per quote line,"#N/A",Monthly,Arrears,Quantity,Recurring,false,"#N/A","#N/A","#N/A","#N/A","#N/A","#N/A","#N/A","#N/A","#N/A",false,"#N/A",false,"#N/A","#N/A",1.0,false,"#N/A",false,false,false,false,"#N/A",false,false,false,false,false,false,false,false,"#N/A",Click,false,false,false,List,"#N/A",false,"#N/A",false,"#N/A","#N/A",List,"#N/A","#N/A",Fixed Price,12.0,Renewable,"#N/A",false,"#N/A","#N/A","#N/A"
d314a1d5-9788-4ebf-9359-76bc8c9ccf03,Flat Professional Service Rates for mixed-us.,"#N/A","#N/A",Services,true,Professional Service Hours (Usage),SRV-002-U,"#N/A",Default,One per quote line,"#N/A","#N/A","#N/A",Quantity,Usage,false,"#N/A","#N/A","#N/A","#N/A","#N/A","#N/A","#N/A","#N/A","#N/A",false,"#N/A",false,"#N/A","#N/A",1.0,false,"#N/A",false,false,false,false,"#N/A",false,false,false,false,false,false,true,false,"#N/A",Click,false,false,false,List,"#N/A",true,"#N/A",false,"#N/A","#N/A",List,"#N/A","#N/A","#N/A",1.0,Renewable,"#N/A",false,"#N/A","#N/A","#N/A"
d3615d93-d8bf-439c-8eb6-3b82bca32bcb,Network Security Specialist for Atomic Security Suite Deployments,"#N/A","#N/A",Services,true,Endpoint Security Specialist,SRVR-004,"#N/A",Default,"#N/A","#N/A","#N/A","#N/A",Quantity,One-Time,false,"#N/A","#N/A","#N/A","#N/A","#N/A","#N/A","#N/A","#N/A","#N/A",false,"#N/A",false,"#N/A","#N/A",1.0,false,"#N/A",false,false,false,false,"#N/A",false,false,false,false,false,false,false,false,"#N/A",Click,false,false,false,List,"#N/A",true,"#N/A",false,"#N/A","#N/A",List,"#N/A","#N/A","#N/A","#N/A",Renewable,"#N/A",false,"#N/A","#N/A","#N/A"
d7cf7c42-1ba4-4a20-9281-45b3b14d4d22,"Mounting hardware includes light and heavy-duty shelves, bolt-down brackets, stabilization plates, grounding kits, keyboard drawers, mounting rails, brackets, and associated hardware.","#N/A","#N/A",Hardware,true,TX Bolt-Down Kit,BSSA-4304,"#N/A",Allow Refund,One per quote line,"#N/A","#N/A","#N/A",Quantity,One-Time,true,"#N/A","#N/A","#N/A","#N/A","#N/A",Disabled,"#N/A","#N/A","#N/A",false,"#N/A",false,"#N/A","#N/A",1.0,false,"#N/A",false,false,false,false,"#N/A",false,false,false,false,true,false,false,false,Tabs,Click,false,false,false,List,"#N/A",true,"#N/A",false,"#N/A","#N/A",List,Hardware,"#N/A","#N/A","#N/A",One-time,"#N/A",false,"#N/A","#N/A","#N/A"
da2a5c92-2cb7-4345-a9b3-a4d7c553cbe2,Currency Conversion Credit,"#N/A","#N/A","#N/A",true,Currency Conversion Credit,curr-credit,"#N/A",Default,One per quote line,"#N/A","#N/A","#N/A",Quantity,One-Time,true,"#N/A","#N/A","#N/A","#N/A","#N/A","#N/A","#N/A","#N/A","#N/A",false,"#N/A",false,"#N/A","#N/A",1.0,false,"#N/A",false,false,false,false,"#N/A",false,false,false,false,false,false,false,false,"#N/A",Click,false,true,false,List,"#N/A",true,"#N/A",false,"#N/A","#N/A",List,"#N/A","#N/A","#N/A","#N/A",Renewable,"#N/A",false,"#N/A","#N/A","#N/A"
db70ab67-3171-4997-ac3d-bf3e7b7f3647,Threat Intelligence Exchange Report Tools allows for audit extraction into data warehouse formats for offline analysis.,"#N/A","#N/A",Software,true,Threat Intelligence Reporting Tools,SM-004,"#N/A",Default,One per quote line,"#N/A",Monthly,Arrears,Quantity,Recurring,false,"#N/A","#N/A","#N/A","#N/A","#N/A","#N/A","#N/A","#N/A","#N/A",false,"#N/A",false,"#N/A","#N/A",1.0,false,"#N/A",false,false,false,false,"#N/A",false,false,false,false,false,false,false,false,"#N/A",Click,false,false,false,List,"#N/A",false,"#N/A",false,"#N/A","#N/A",List,"#N/A","#N/A",Fixed Price,12.0,Renewable,"#N/A",false,"#N/A","#N/A","#N/A"
dc2e1f7d-dd5f-42e5-b1e1-3e1610e85284,"Support and protect your IT equipment with rack enclosures designed for flexible deployments, usability and infrastructure scalability.","#N/A","#N/A",Hardware,true,Maxspace Rack Enclosure,MAXS-1014,"#N/A",Allow Refund,One per quote line,"#N/A","#N/A","#N/A",Quantity,One-Time,false,"#N/A",Always,"#N/A","#N/A","#N/A",Required,"#N/A","#N/A","#N/A",false,"#N/A",false,"#N/A","#N/A",1.0,false,"#N/A",false,false,false,false,"#N/A",false,false,false,true,true,false,false,false,Tabs,Click,false,false,false,List,"#N/A",true,"#N/A",false,"#N/A","#N/A",List,Hardware,"#N/A","#N/A","#N/A",One-time,"#N/A",false,"#N/A","#N/A","#N/A"
dced69e5-9c89-44f0-9e57-62538dcc0ff1,8TB 7.2k RPM NLSAS 12Gps 3.5 in - Industry-leading rotational vibration tolerance design helps ensure consistent performance in dense multi-drive systems,"#N/A","#N/A",Hardware,true,8TB 7.2k RPM NLSAS,HD 8TB,"#N/A",Allow Refund,One per quote line,"#N/A","#N/A","#N/A",Quantity,One-Time,true,"#N/A","#N/A","#N/A","#N/A","#N/A",Disabled,"#N/A","#N/A","#N/A",false,"#N/A",false,"#N/A","#N/A",1.0,false,"#N/A",false,false,false,false,Do Not Generate,false,false,false,false,true,false,false,false,Tabs,Click,false,false,false,List,"#N/A",true,"#N/A",false,"#N/A","#N/A",List,Hardware,"#N/A","#N/A","#N/A",One-time,"#N/A",false,"#N/A","#N/A","#N/A"
dece9ae4-b0c9-4ed1-8c44-d7723a8e8b16,"Rack PDU 5.7W, 208V, 3 phase CS8365 input C13 output - Basic Rack Power Distribution Unit allows users to distribute power outlets to rack-mount equipment.","#N/A","#N/A",Hardware,true,"Rack PDU 5.7W, 208V, C13 output",PDU-2029,"#N/A",Allow Refund,One per quote line,"#N/A","#N/A","#N/A",Quantity,One-Time,true,"#N/A","#N/A","#N/A","#N/A","#N/A",Disabled,"#N/A","#N/A","#N/A",false,"#N/A",false,"#N/A","#N/A",1.0,false,"#N/A",false,false,false,false,"#N/A",false,false,false,false,true,false,false,false,Tabs,Click,false,false,false,List,"#N/A",true,"#N/A",false,"#N/A","#N/A",List,Hardware,"#N/A","#N/A","#N/A",One-time,"#N/A",false,"#N/A","#N/A","#N/A"
dfcafd36-7cd3-475c-8958-c5e0461a12e9,Data Center Security Suite for Databases gives you complete visibility into your database landscape and security posture.,"#N/A","#N/A",Software,true,Data Center Security Suite,DBS-001,"#N/A",Default,One per quote line,"#N/A",Monthly,Arrears,Quantity,Recurring,false,"#N/A","#N/A","#N/A","#N/A","#N/A","#N/A","#N/A","#N/A","#N/A",false,"#N/A",false,"#N/A","#N/A",1.0,false,"#N/A",false,false,false,false,"#N/A",false,false,false,false,false,false,false,false,"#N/A",Click,false,false,false,List,"#N/A",true,"#N/A",false,"#N/A","#N/A",List,"#N/A","#N/A",Fixed Price,12.0,Renewable,"#N/A",false,"#N/A","#N/A","#N/A"
e1009f69-f542-4bef-9b06-f532ff690907,Application Protection for an unlimited number of applications.,"#N/A","#N/A",Software,true,Application Protection Unlimited,S-SSO-APU,"#N/A",Default,One per quote line,"#N/A",Annual,Advance,Quantity,Recurring,false,"#N/A","#N/A","#N/A","#N/A","#N/A","#N/A","#N/A","#N/A","#N/A",false,"#N/A",false,"#N/A","#N/A",1.0,false,"#N/A",false,false,false,false,"#N/A",false,false,false,false,false,false,true,false,"#N/A",Click,false,false,false,List,"#N/A",true,"#N/A",false,"#N/A","#N/A",List,"#N/A","#N/A",Fixed Price,12.0,Renewable,"#N/A",false,"#N/A","#N/A","#N/A"
e3348f7b-2d4c-4822-a873-457b32b556e0,Policy Auditor software automates security audit processes and helps you report consistently and accurately against internal and external policies.,"#N/A","#N/A",Software,true,Policy Auditor,SS-006,"#N/A",Default,One per quote line,"#N/A",Annual,Advance,Quantity,Recurring,false,"#N/A","#N/A","#N/A","#N/A","#N/A","#N/A","#N/A","#N/A","#N/A",false,"#N/A",false,"#N/A","#N/A",1.0,false,"#N/A",false,false,false,false,"#N/A",false,false,false,false,false,false,false,false,"#N/A",Click,false,false,false,List,"#N/A",true,"#N/A",false,"#N/A","#N/A",List,OnPremise,"#N/A",Fixed Price,12.0,"#N/A","#N/A",false,"#N/A","#N/A","#N/A"
e35174c2-6bab-422c-93c6-0325ea4a3f88,"Rack PDU Metered 20A, 120V L5-20 input 5-20 output - Metered Rack Power Distribution Units (PDUs) provide active metering to enable energy optimization and circuit protection.","#N/A","#N/A",Hardware,true,"Rack PDU Metered 20A, 120V L5-20",MPDU-3004,"#N/A",Allow Refund,One per quote line,"#N/A","#N/A","#N/A",Quantity,One-Time,true,"#N/A","#N/A","#N/A","#N/A","#N/A",Disabled,"#N/A","#N/A","#N/A",false,"#N/A",false,"#N/A","#N/A",1.0,false,"#N/A",false,false,false,false,"#N/A",false,false,false,false,false,false,false,false,Tabs,Click,false,false,false,List,"#N/A",true,"#N/A",false,"#N/A","#N/A",List,"#N/A","#N/A","#N/A","#N/A",One-time,"#N/A",false,"#N/A","#N/A","#N/A"
e38b111f-fe34-4686-bcd1-b9d33e03c12e,The Power Cord is designed to provide ideal electrical connectivity to your equipments. It operates at 250-Volt voltage range.,"#N/A","#N/A",Hardware,true,C19 to C20 Power Cable 5',CMPC-5890,"#N/A",Allow Refund,One per quote line,"#N/A","#N/A","#N/A",Quantity,One-Time,true,"#N/A","#N/A","#N/A","#N/A","#N/A",Disabled,"#N/A","#N/A","#N/A",false,"#N/A",false,"#N/A","#N/A",1.0,false,"#N/A",false,false,false,false,"#N/A",false,false,false,false,true,false,false,false,Tabs,Click,false,false,false,List,"#N/A",true,"#N/A",false,"#N/A","#N/A",List,Hardware,"#N/A","#N/A","#N/A",One-time,"#N/A",false,"#N/A","#N/A","#N/A"
