4237efd6-f01f-420d-93a1-74d47bcbb8ba,"#N/A","#N/A","#N/A",Services,true,Quick Deploy,SRV-001,"#N/A",Default,"#N/A","#N/A",Invoice Plan,Advance,Quantity,Recurring,false,"#N/A","#N/A","#N/A","#N/A","#N/A","#N/A","#N/A","#N/A","#N/A",false,"#N/A",false,"#N/A","#N/A",1.0,false,"#N/A",false,false,false,false,"#N/A",false,false,false,false,false,false,true,false,"#N/A",Click,false,false,false,List,"#N/A",true,"#N/A",false,"#N/A","#N/A",List,"#N/A","#N/A","#N/A","#N/A",Renewable,"#N/A",false,"#N/A","#N/A","#N/A"
43745f53-f268-400e-8cd5-2d39b92144af,Basic Consulting package for implementation managed by 3rd party SI/Partner on Fixed Fee basis.,"#N/A","#N/A",Services,true,Quick Start Enablement,SV-QSE,"#N/A",Default,One per quote line,"#N/A","#N/A","#N/A",Quantity,One-Time,false,"#N/A","#N/A","#N/A","#N/A","#N/A","#N/A","#N/A","#N/A","#N/A",false,"#N/A",false,"#N/A","#N/A",1.0,false,"#N/A",false,false,false,false,"#N/A",false,false,false,false,false,false,true,false,"#N/A",Click,false,false,false,List,"#N/A",true,"#N/A",false,"#N/A","#N/A",List,"#N/A","#N/A","#N/A","#N/A",Renewable,"#N/A",false,"#N/A","#N/A","#N/A"
44ebec51-5feb-44bd-bcc1-405f46f94087,"Occupying 1U of rack space, this sliding shelf provides ventilation, and easy access to severs.","#N/A","#N/A",Hardware,true,Sliding Shelf 200lbs,BSSA-4300,"#N/A",Allow Refund,One per quote line,"#N/A","#N/A","#N/A",Quantity,One-Time,true,"#N/A","#N/A","#N/A","#N/A","#N/A",Disabled,"#N/A","#N/A","#N/A",false,"#N/A",false,"#N/A","#N/A",1.0,false,"#N/A",false,false,false,false,"#N/A",false,false,false,false,true,false,false,false,Tabs,Click,false,false,false,List,"#N/A",true,"#N/A",false,"#N/A","#N/A",List,Hardware,"#N/A","#N/A","#N/A",One-time,"#N/A",false,"#N/A","#N/A","#N/A"
4734a66d-d5b1-4284-890b-b46a9696f926,"Advanced Correlation Engine with Enterprise Security Manager to identify and score threat events in real time, using both rule- and risk-based logic.","#N/A","#N/A",Software,true,Advanced Correlation Engine,SIEM-001,"#N/A",Default,One per quote line,"#N/A",Monthly,Arrears,Quantity,Recurring,false,"#N/A","#N/A","#N/A","#N/A","#N/A","#N/A","#N/A","#N/A","#N/A",false,"#N/A",false,"#N/A","#N/A",1.0,false,"#N/A",false,false,false,false,"#N/A",false,false,false,false,false,false,false,false,"#N/A",Click,false,false,false,List,"#N/A",true,"#N/A",false,"#N/A","#N/A",List,"#N/A","#N/A",Fixed Price,12.0,Renewable,"#N/A",false,"#N/A","#N/A","#N/A"
47a6f45d-7e62-4e79-af47-c8dee8228846,"Upgrade, Bug Fixes, and Patched for Perpetual Licenses.
Early Access to BETA Releases. Upgrade and Patch Assistance. 20% of Licensing","#N/A","#N/A",Services,true,Software Maintenance,SUPP-2000,"#N/A",Default,One per quote line,"#N/A",Annual,Advance,Quantity,Recurring,true,"#N/A","#N/A","#N/A","#N/A","#N/A",Disabled,"#N/A","#N/A","#N/A",false,"#N/A",false,"#N/A","#N/A",1.0,false,"#N/A",false,false,false,false,"#N/A",false,false,false,false,false,false,true,false,Tabs,Click,false,false,false,List,"#N/A",true,"#N/A",false,"#N/A","#N/A",Net,Software,20.0,Percent Of Total,12.0,Renewable,"#N/A",false,"#N/A","#N/A","#N/A"
47b6c117-e408-4999-a338-9bd5942e4433,"Intel Xeon E5-2667 v4 3.2GHz,25M Cache,9.60GT/s 8C/16T (135W) - Designed for software defined infrastructure supercharged for efficiency, performance, and agile services delivery across cloud-native and traditional applications.","#N/A","#N/A",Hardware,true,Intel Xeon E5-2667 v4 3.2GHz,INTEL E5-2667,"#N/A",Allow Refund,One per quote line,"#N/A","#N/A","#N/A",Quantity,One-Time,true,"#N/A","#N/A","#N/A","#N/A","#N/A",Disabled,"#N/A","#N/A","#N/A",false,"#N/A",false,"#N/A","#N/A",1.0,false,"#N/A",false,false,false,false,Do Not Generate,false,false,false,false,true,false,false,false,Tabs,Click,false,false,false,List,"#N/A",true,"#N/A",false,"#N/A","#N/A",List,Hardware,"#N/A","#N/A","#N/A",One-time,"#N/A",false,"#N/A","#N/A","#N/A"
4899cc5c-b276-4270-bfbd-172cbf072431,Our certified Integration Specialist Engineers bring a wealth of application expertise and integration experience to ensure the client's other systems are connected.,"#N/A","#N/A",Services,true,Integration Specialist Engineer,SV-ISE,"#N/A",Default,One per quote line,"#N/A","#N/A","#N/A",Quantity,One-Time,true,"#N/A","#N/A","#N/A","#N/A","#N/A","#N/A","#N/A","#N/A","#N/A",false,"#N/A",false,"#N/A","#N/A",1.0,false,"#N/A",false,false,false,false,"#N/A",false,false,false,false,false,false,false,false,"#N/A",Click,false,false,false,List,"#N/A",true,"#N/A",false,"#N/A","#N/A",List,"#N/A","#N/A","#N/A","#N/A",Renewable,"#N/A",false,"#N/A","#N/A","#N/A"
48aec012-7e53-40ef-8b31-ba07f11dd806,Web Gateway delivers high-performance web security through an on-premises appliance that can be deployed both as dedicated hardware and a virtual machine.,"#N/A","#N/A",Software,true,Web Gateway,WS-001,"#N/A",Default,One per quote line,"#N/A",Monthly,Arrears,Quantity,Recurring,false,"#N/A","#N/A","#N/A","#N/A","#N/A","#N/A","#N/A","#N/A","#N/A",false,"#N/A",false,"#N/A","#N/A",1.0,false,"#N/A",false,false,false,false,"#N/A",false,false,false,false,false,false,false,false,"#N/A",Click,false,false,false,List,"#N/A",true,"#N/A",false,"#N/A","#N/A",List,"#N/A","#N/A",Fixed Price,1.0,Renewable,"#N/A",false,"#N/A","#N/A","#N/A"
4ca4b204-b92f-4bd4-9329-16326b651ef0,Installation and Assembly of a Maxspace Rack by a Infinity Solution Certified techniction,"#N/A","#N/A",Services,true,Installation and Assembly,INST-1000,"#N/A",Allow Refund,One per quote line,"#N/A","#N/A","#N/A",Quantity,One-Time,true,"#N/A","#N/A","#N/A","#N/A","#N/A",Disabled,"#N/A","#N/A","#N/A",false,"#N/A",false,"#N/A","#N/A",1.0,false,"#N/A",false,false,false,false,"#N/A",false,false,false,false,false,false,false,false,Tabs,Click,false,true,false,List,"#N/A",true,"#N/A",false,"#N/A","#N/A",List,"#N/A","#N/A","#N/A","#N/A",Renewable,"#N/A",false,"#N/A","#N/A","#N/A"
4d9d2c5d-2db9-4cee-87b0-ed2955610dda,Online Admin Training for the Single Sign On Suite,"#N/A","#N/A",Services,true,SSO Admin Training,S-SSO-ADTR,"#N/A",Default,One per quote line,"#N/A","#N/A","#N/A",Quantity,One-Time,false,"#N/A","#N/A","#N/A","#N/A","#N/A","#N/A","#N/A","#N/A","#N/A",false,"#N/A",false,"#N/A","#N/A",1.0,false,"#N/A",false,false,false,false,"#N/A",false,false,false,false,false,false,false,false,"#N/A",Click,false,false,false,List,"#N/A",true,"#N/A",false,"#N/A","#N/A",List,"#N/A","#N/A","#N/A","#N/A",Renewable,"#N/A",false,"#N/A","#N/A","#N/A"
4db2ac0d-0c98-407f-b72c-0cd6c3314375,"Intel E5-2680 v4 2.4GHz,35M Cache,9.60GT/s QPI,Turbo,HT,14C/28T (120W) - Designed for software defined infrastructure supercharged for efficiency, performance, and agile services delivery across cloud-native and traditional applications.","#N/A","#N/A",Hardware,true,Intel E5-2680 v4 2.4GHz,INTEL E5-2680,"#N/A",Allow Refund,One per quote line,"#N/A","#N/A","#N/A",Quantity,One-Time,true,"#N/A","#N/A","#N/A","#N/A","#N/A",Disabled,"#N/A","#N/A","#N/A",false,"#N/A",false,"#N/A","#N/A",1.0,false,"#N/A",false,false,false,false,Do Not Generate,false,false,false,false,false,false,false,false,Tabs,Click,false,false,false,List,"#N/A",true,"#N/A",false,"#N/A","#N/A",List,"#N/A","#N/A","#N/A","#N/A",One-time,"#N/A",false,"#N/A","#N/A","#N/A"
50671e03-5e37-425f-b6d9-ead577283320,On Premise Maintenance Fees,"#N/A","#N/A",Software,true,Maintenance,SSM-0001,"#N/A",Default,One per quote line,"#N/A",Monthly,Advance,Quantity,Recurring,false,"#N/A","#N/A","#N/A","#N/A","#N/A","#N/A","#N/A","#N/A","#N/A",false,"#N/A",false,"#N/A","#N/A",1.0,false,"#N/A",false,false,false,false,"#N/A",false,false,false,false,false,false,false,false,"#N/A",Click,false,false,false,List,"#N/A",false,"#N/A",false,"#N/A","#N/A",List,OnPremise,20.0,Percent Of Total,12.0,Renewable,"#N/A",false,"#N/A","#N/A","#N/A"
50f2cd73-aa3a-417a-8576-980c4db5d263,"Virtual Network Security Platform delivers a complete network security solution ready for the unique demands of private, public, and hybrid clouds.","#N/A","#N/A",Software,true,Virtual Network Security Platform,NS-003,"#N/A",Default,One per quote line,"#N/A",Monthly,Arrears,Quantity,Recurring,false,"#N/A","#N/A","#N/A","#N/A","#N/A","#N/A","#N/A","#N/A","#N/A",false,"#N/A",false,"#N/A","#N/A",1.0,false,"#N/A",false,false,false,false,"#N/A",false,false,false,false,false,false,false,false,"#N/A",Click,false,false,false,List,"#N/A",true,"#N/A",false,"#N/A","#N/A",List,"#N/A","#N/A",Fixed Price,1.0,Renewable,"#N/A",false,"#N/A","#N/A","#N/A"
530374af-1504-4ee0-b3ab-3eb24be14737,"Integrity Control blocks unauthorized applications and change on fixed-function, point-of-service infrastructures, including ATMs, point-of-sale (POS) systems, and kiosks.","#N/A","#N/A",Software,true,Integrity Control,SS-003,"#N/A",Default,One per quote line,"#N/A",Annual,Advance,Quantity,Recurring,false,"#N/A","#N/A","#N/A","#N/A","#N/A","#N/A","#N/A","#N/A","#N/A",false,"#N/A",false,"#N/A","#N/A",1.0,false,"#N/A",false,false,false,false,"#N/A",false,false,false,false,false,false,false,false,"#N/A",Click,false,false,false,List,"#N/A",true,"#N/A",false,"#N/A","#N/A",List,OnPremise,"#N/A",Fixed Price,12.0,"#N/A","#N/A",false,"#N/A","#N/A","#N/A"
5432e834-8868-4a63-a6d3-157453fe6eea,"VirusScan Enterprise for Linux uses a unique, Linux-based on-access scanner that constantly monitors your system for potential attacks.","#N/A","#N/A",Software,true,VirusScan Enterprise for Linux,EP-014,"#N/A",Default,One per quote line,"#N/A",Monthly,Arrears,Quantity,Recurring,false,"#N/A","#N/A","#N/A","#N/A","#N/A","#N/A","#N/A","#N/A","#N/A",false,"#N/A",false,"#N/A",Standard,1.0,false,"#N/A",false,false,false,false,"#N/A",false,false,false,false,false,false,false,false,"#N/A",Click,false,false,false,List,"#N/A",true,"#N/A",false,"#N/A","#N/A",List,"#N/A","#N/A",Fixed Price,1.0,Renewable,"#N/A",false,"#N/A","#N/A","#N/A"
569d63a5-8e9d-4db3-a2c2-5f70a87916f6,"Endpoint Security for Mac protects Macintosh endpoints against viruses, spyware, Trojan horses, and other malware threats.","#N/A","#N/A",Software,true,Endpoint Security for Mac,EP-005,"#N/A",Default,One per quote line,"#N/A",Monthly,Arrears,Quantity,Recurring,false,"#N/A","#N/A","#N/A","#N/A","#N/A","#N/A","#N/A","#N/A","#N/A",false,"#N/A",false,"#N/A","#N/A",1.0,false,"#N/A",false,false,false,false,"#N/A",false,false,false,false,false,false,false,false,"#N/A",Click,false,false,false,List,"#N/A",true,"#N/A",false,"#N/A","#N/A",List,"#N/A","#N/A",Fixed Price,1.0,Renewable,"#N/A",false,"#N/A","#N/A","#N/A"
5a4d4970-4054-4a7a-a283-52532ad347b6,Roof Fan Tray promotes bottom to top airflow for an enclosure in zero U of space. It cools by exhausting heat out of the roof of the rack.,"#N/A","#N/A",Hardware,true,Roof Fan Tray 750mm - 208V,BSSA-4308,"#N/A",Allow Refund,One per quote line,"#N/A","#N/A","#N/A",Quantity,One-Time,true,"#N/A","#N/A","#N/A","#N/A","#N/A",Disabled,"#N/A","#N/A","#N/A",false,"#N/A",false,"#N/A","#N/A",1.0,false,"#N/A",false,false,false,false,"#N/A",false,false,false,false,true,false,false,false,Tabs,Click,false,false,false,List,"#N/A",true,"#N/A",false,"#N/A","#N/A",List,Hardware,"#N/A","#N/A","#N/A",One-time,"#N/A",false,"#N/A","#N/A","#N/A"
5bfc1eaf-7bc5-44f9-803a-236f357502f2,Our certified Implementation Engineers bring a wealth of application expertise and integration experience to ensure the clients other systems are connected.,"#N/A","#N/A",Services,true,Implementation Engineer,SV-IMP,"#N/A",Default,One per quote line,"#N/A","#N/A","#N/A",Quantity,One-Time,false,"#N/A","#N/A","#N/A","#N/A","#N/A","#N/A","#N/A","#N/A","#N/A",false,"#N/A",false,"#N/A","#N/A",1.0,false,"#N/A",false,false,false,false,"#N/A",false,false,false,false,false,false,true,false,"#N/A",Click,false,false,false,List,"#N/A",true,"#N/A",false,"#N/A","#N/A",List,"#N/A","#N/A","#N/A","#N/A",Renewable,"#N/A",false,"#N/A","#N/A","#N/A"
5c068627-d4f4-4d47-9caa-ad2ac1316a5b,Complete Threat Platform Solution is a comprehensive package that provides advanced defenses that investigate and contain zero-day threats and sophisticated attacks across multiple avenues.,"#N/A","#N/A",Software,false,Atomic Security Platform,EP-0001,"#N/A",Default,One per quote line,"#N/A",Annual,Advance,Quantity,Recurring,false,"#N/A",Always,"#N/A","#N/A","#N/A",Required,"#N/A","#N/A","#N/A",false,"#N/A",false,"#N/A","#N/A",1.0,false,"#N/A",false,false,false,false,"#N/A",true,false,false,false,false,false,true,true,"#N/A",Click,false,false,false,List,"#N/A",true,"#N/A",false,"#N/A","#N/A",List,"#N/A","#N/A",Fixed Price,1.0,Renewable,"#N/A",false,"#N/A","#N/A","#N/A"
5c2829d4-a505-448a-b534-180781c749a4,"Web Gateway Cloud Service eliminates the constraints of on-network web security by connecting users from any device or location to the internet through our cloud, maintaining protection wherever they go.","#N/A","#N/A",Software,true,Web Gateway Cloud Service,WS-002,"#N/A",Default,One per quote line,"#N/A",Monthly,Arrears,Quantity,Recurring,false,"#N/A","#N/A","#N/A","#N/A","#N/A","#N/A","#N/A","#N/A","#N/A",false,"#N/A",false,"#N/A","#N/A",1.0,false,"#N/A",false,false,false,false,"#N/A",false,false,false,false,false,false,false,false,"#N/A",Click,false,false,false,List,"#N/A",true,"#N/A",false,"#N/A","#N/A",List,"#N/A","#N/A",Fixed Price,1.0,Renewable,"#N/A",false,"#N/A","#N/A","#N/A"
5ccf11c1-b130-4d01-b7a9-f794fb1f2984,These accessories offer the proper cable management options to meet varying needs.,"#N/A","#N/A",Hardware,true,Cable Containment Brackets,CMPC-5884,"#N/A",Allow Refund,One per quote line,"#N/A","#N/A","#N/A",Quantity,One-Time,true,"#N/A","#N/A","#N/A","#N/A","#N/A",Disabled,"#N/A","#N/A","#N/A",false,"#N/A",false,"#N/A","#N/A",1.0,false,"#N/A",false,false,false,false,"#N/A",false,false,false,false,true,false,false,false,Tabs,Click,false,false,false,List,"#N/A",true,"#N/A",false,"#N/A","#N/A",List,Hardware,"#N/A","#N/A","#N/A",One-time,"#N/A",false,"#N/A","#N/A","#N/A"
5df7dfe6-997c-41db-a867-12c6919ce114,"Intel E5-2695 v4 2.1GHz,45M Cache,9.60GT/s QPI,Turbo,HT,18C/36T (120W) - Designed for software defined infrastructure supercharged for efficiency, performance, and agile services delivery across cloud-native and traditional applications.","#N/A","#N/A",Hardware,true,Intel E5-2695 v4 2.1GHz,INTEL E5-2695,"#N/A",Allow Refund,One per quote line,"#N/A","#N/A","#N/A",Quantity,One-Time,true,"#N/A","#N/A","#N/A","#N/A","#N/A",Disabled,"#N/A","#N/A","#N/A",false,"#N/A",false,"#N/A","#N/A",1.0,false,"#N/A",false,false,false,false,Do Not Generate,false,false,false,false,false,false,false,false,Tabs,Click,false,false,false,List,"#N/A",true,"#N/A",false,"#N/A","#N/A",List,"#N/A","#N/A","#N/A","#N/A",One-time,"#N/A",false,"#N/A","#N/A","#N/A"
5e0b8794-2520-43e5-ac65-4ebaf7dc5852,"Data Normalization Experts engage early in the project and assist customers in normalizing, cleaning, and de-duping data, and can perform upload and update functions.","#N/A","#N/A",Services,true,Data Normalization Expert,SV-DNE,"#N/A",Default,One per quote line,"#N/A","#N/A","#N/A",Quantity,One-Time,true,"#N/A","#N/A","#N/A","#N/A","#N/A","#N/A","#N/A","#N/A","#N/A",false,"#N/A",false,"#N/A","#N/A",1.0,false,"#N/A",false,false,false,false,"#N/A",false,false,false,false,false,false,false,false,"#N/A",Click,false,false,false,List,"#N/A",true,"#N/A",false,"#N/A","#N/A",List,"#N/A","#N/A","#N/A","#N/A",Renewable,"#N/A",false,"#N/A","#N/A","#N/A"
5f608148-2260-4969-92f2-1e1b5e2d7e23,"Rack PDU 14.4kW, 208V, 3 phase CS8365 input C13 output - Basic Rack Power Distribution Unit allows users to distribute power outlets to rack-mount equipment.","#N/A","#N/A",Hardware,true,"Rack PDU 14.4kW, 208V, C13 output",PDU-2028,"#N/A",Allow Refund,One per quote line,"#N/A","#N/A","#N/A",Quantity,One-Time,true,"#N/A","#N/A","#N/A","#N/A","#N/A",Disabled,"#N/A","#N/A","#N/A",false,"#N/A",false,"#N/A","#N/A",1.0,false,"#N/A",false,false,false,false,"#N/A",false,false,false,false,true,false,false,false,Tabs,Click,false,false,false,List,"#N/A",true,"#N/A",false,"#N/A","#N/A",List,Hardware,"#N/A","#N/A","#N/A",One-time,"#N/A",false,"#N/A","#N/A","#N/A"
5f840018-edbc-45a1-a1e0-baffde6a4236,"Rack PDU 20A, 120V L5-20 input 5-20 output - Basic Rack Power Distribution Unit allows users to distribute power outlets to rack-mount equipment.","#N/A","#N/A",Hardware,true,"Rack PDU 20A, 120V L5-20",PDU-2022,"#N/A",Allow Refund,One per quote line,"#N/A","#N/A","#N/A",Quantity,One-Time,true,"#N/A","#N/A","#N/A","#N/A","#N/A",Disabled,"#N/A","#N/A","#N/A",false,"#N/A",false,"#N/A","#N/A",1.0,false,"#N/A",false,false,false,false,"#N/A",false,false,false,false,true,false,false,false,Tabs,Click,false,false,false,List,"#N/A",true,"#N/A",false,"#N/A","#N/A",List,Hardware,"#N/A","#N/A","#N/A",One-time,"#N/A",false,"#N/A","#N/A","#N/A"
618fd80a-d691-49fd-b94f-86f662c382a1,Access to advanced server features.,"#N/A","#N/A",Software,true,Advanced Server Access,S-SSO-ASA,"#N/A",Default,One per quote line,"#N/A",Annual,Advance,Quantity,Recurring,false,"#N/A","#N/A","#N/A","#N/A","#N/A","#N/A","#N/A","#N/A","#N/A",false,"#N/A",false,"#N/A","#N/A",1.0,false,"#N/A",false,false,false,false,"#N/A",false,false,false,false,false,false,false,false,"#N/A",Click,false,false,false,List,"#N/A",true,"#N/A",false,"#N/A","#N/A",List,"#N/A","#N/A",Fixed Price,12.0,Renewable,"#N/A",false,"#N/A","#N/A","#N/A"
6313932e-423d-48e1-afb8-b8243b2f6c66,Windows Server Datacenter edition is designed for organizations with large workloads and heavily virtualized server environments.,"#N/A","#N/A",Software,true,Windows Server Datacenter - Monthly,WIN SDATA-M,"#N/A",Default,One per quote line,"#N/A",Monthly,Advance,Quantity,Recurring,true,"#N/A","#N/A","#N/A","#N/A","#N/A",Disabled,"#N/A","#N/A","#N/A",false,"#N/A",false,"#N/A","#N/A",1.0,false,"#N/A",false,false,false,false,"#N/A",false,false,false,false,true,false,false,false,Tabs,Click,false,false,false,List,"#N/A",true,"#N/A",false,"#N/A","#N/A",List,Software,"#N/A",Fixed Price,1.0,Renewable,"#N/A",false,"#N/A","#N/A","#N/A"
6477e3e1-3a76-45ab-8712-4df2276412e3,"Endpoint Threat Protection delivers integrated anti-malware, firewall, web, email, and device control in a single solution. This includes both threat and response solutions.","#N/A","#N/A",Software,true,Endpoint Threat Protection,EP-008,"#N/A",Default,One per quote line,"#N/A",Monthly,Arrears,Quantity,Recurring,false,"#N/A","#N/A","#N/A","#N/A","#N/A","#N/A","#N/A","#N/A","#N/A",false,"#N/A",false,"#N/A","#N/A",1.0,false,"#N/A",false,false,false,false,"#N/A",false,false,false,false,false,false,false,false,"#N/A",Click,false,false,false,List,"#N/A",true,"#N/A",false,"#N/A","#N/A",List,"#N/A","#N/A",Fixed Price,1.0,Renewable,"#N/A",false,"#N/A","#N/A","#N/A"
65833cd3-30c8-447c-9b59-0c428f86f102,Single Sign On Suite,"#N/A","#N/A",Bundle,true,Single Sign On Suite,S-SSO-SAAS,"#N/A",Default,One per quote line,"#N/A",Annual,Advance,Quantity,Recurring,false,"#N/A",Always,"#N/A","#N/A","#N/A",Required,"#N/A","#N/A","#N/A",false,"#N/A",false,"#N/A","#N/A",1.0,false,"#N/A",false,false,false,false,"#N/A",false,false,true,true,false,false,true,false,Sections,Click,false,false,false,List,"#N/A",true,"#N/A",false,2.0,"#N/A",List,"#N/A","#N/A",Fixed Price,1.0,Renewable,"#N/A",false,"#N/A","#N/A","#N/A"
68b286d7-ac49-4efc-a2e2-348d429dcc4a,"Data Loss Prevention (DLP) Discover helps find and remediate sensitive data that resides on your servers, network shares, databases, and in the cloud.","#N/A","#N/A",Software,true,DLP Discover,DP-005,"#N/A",Default,One per quote line,"#N/A",Monthly,Arrears,Quantity,Recurring,false,"#N/A","#N/A","#N/A","#N/A","#N/A","#N/A","#N/A","#N/A","#N/A",false,"#N/A",false,"#N/A","#N/A",1.0,false,"#N/A",false,false,false,false,"#N/A",false,false,false,false,false,false,false,false,"#N/A",Click,false,false,false,List,"#N/A",true,"#N/A",false,"#N/A","#N/A",List,"#N/A","#N/A",Fixed Price,1.0,Renewable,"#N/A",false,"#N/A","#N/A","#N/A"
6a7bff44-aa2e-4158-abbc-a1c4539987ee,"#N/A","#N/A","#N/A",Services,true,Silver Support,SPT-001,"#N/A",Default,"#N/A","#N/A","#N/A","#N/A",Quantity,One-Time,false,"#N/A","#N/A","#N/A","#N/A","#N/A","#N/A","#N/A","#N/A","#N/A",false,"#N/A",false,"#N/A","#N/A",1.0,false,"#N/A",false,false,false,false,"#N/A",false,false,false,false,false,false,true,false,"#N/A",Click,false,false,false,List,"#N/A",false,"#N/A",false,"#N/A","#N/A",List,"#N/A","#N/A",Fixed Price,12.0,Renewable,"#N/A",false,"#N/A","#N/A","#N/A"
6d361ddd-1c91-48b7-9813-dcfd916b0a77,"The Program Director provides executive leadership, subject matter expertise, and program oversight.","#N/A","#N/A",Services,true,Program Director,SV-PD,"#N/A",Default,One per quote line,"#N/A","#N/A","#N/A",Quantity,One-Time,false,"#N/A","#N/A","#N/A","#N/A","#N/A","#N/A","#N/A","#N/A","#N/A",false,"#N/A",false,"#N/A","#N/A",1.0,false,"#N/A",false,false,false,false,"#N/A",false,false,false,false,false,false,true,false,"#N/A",Click,false,false,false,List,"#N/A",true,"#N/A",false,"#N/A","#N/A",List,"#N/A","#N/A","#N/A","#N/A",Renewable,"#N/A",false,"#N/A","#N/A","#N/A"
6d94ca8e-7cda-4db4-bdf2-4770b006b73d,The Power Cord is designed to provide ideal electrical connectivity to your equipments. It operates at 250-Volt voltage range.,"#N/A","#N/A",Hardware,true,C19 to C20 Power Cable 3',CMPC-5889,"#N/A",Allow Refund,One per quote line,"#N/A","#N/A","#N/A",Quantity,One-Time,true,"#N/A","#N/A","#N/A","#N/A","#N/A",Disabled,"#N/A","#N/A","#N/A",false,"#N/A",false,"#N/A","#N/A",1.0,false,"#N/A",false,false,false,false,"#N/A",false,false,false,false,true,false,false,false,Tabs,Click,false,false,false,List,"#N/A",true,"#N/A",false,"#N/A","#N/A",List,Hardware,"#N/A","#N/A","#N/A",One-time,"#N/A",false,"#N/A","#N/A","#N/A"
6ffb347d-cebe-4e20-be7f-c5a5e8173166,Universal Data Collection / Indexing combines high-end data collection with consumption based indexing and cloud machine learning analyzing real-time network data.,"#N/A","#N/A",Software,true,Universal Data Collection / Indexing,DC-008,"#N/A",Default,One per quote line,"#N/A",Monthly,Arrears,Quantity,Recurring,false,"#N/A","#N/A","#N/A","#N/A","#N/A","#N/A","#N/A","#N/A","#N/A",false,"#N/A",false,"#N/A","#N/A",1.0,false,"#N/A",false,false,false,false,"#N/A",false,true,false,false,false,false,true,false,"#N/A",Click,false,false,false,List,"#N/A",true,"#N/A",false,"#N/A","#N/A",List,"#N/A","#N/A",Fixed Price,1.0,Renewable,"#N/A",false,"#N/A","#N/A","#N/A"
72d7b677-cd34-49f2-8af7-7f15c475bfba,Professional Services Project w/ Individually Selected Resources.,"#N/A","#N/A",Services,true,Scoped Services Project,SRV-003,"#N/A",Default,"#N/A","#N/A","#N/A","#N/A",Quantity,One-Time,false,"#N/A",Always,"#N/A","#N/A","#N/A",Required,"#N/A","#N/A","#N/A",false,"#N/A",false,"#N/A","#N/A",1.0,false,"#N/A",false,false,false,false,"#N/A",false,false,false,false,false,false,true,false,"#N/A",Click,false,false,false,List,"#N/A",true,"#N/A",false,"#N/A","#N/A",List,"#N/A","#N/A","#N/A","#N/A",Renewable,"#N/A",false,"#N/A","#N/A","#N/A"
72e35837-01ce-4792-a4fe-810bdf0efe42,"Red Hat Enterprise Linux delivers military-grade security, 99.999% uptime, support for business-critical workloads.","#N/A","#N/A",Software,true,Red Hat Enterprise Linux,REDHAT,"#N/A",Allow Refund,One per quote line,"#N/A","#N/A","#N/A",Quantity,One-Time,true,"#N/A","#N/A","#N/A","#N/A","#N/A",Disabled,"#N/A","#N/A","#N/A",false,"#N/A",false,"#N/A","#N/A",1.0,false,"#N/A",false,false,false,false,"#N/A",false,false,false,false,true,false,false,false,Tabs,Click,false,false,false,List,"#N/A",true,"#N/A",false,"#N/A","#N/A",List,Software,"#N/A","#N/A","#N/A",Renewable,"#N/A",false,"#N/A","#N/A","#N/A"
7463b05a-1c1f-4fe9-9199-8d982be201f2,Rack PDU 10A 230V C20 input C19 output - Basic Rack Power Distribution Unit allows users to distribute power outlets to rack-mount equipment.,"#N/A","#N/A",Hardware,true,"Rack PDU 10A, 230V C20 input C19",PDU-2026,"#N/A",Allow Refund,One per quote line,"#N/A","#N/A","#N/A",Quantity,One-Time,true,"#N/A","#N/A","#N/A","#N/A","#N/A",Disabled,"#N/A","#N/A","#N/A",false,"#N/A",false,"#N/A","#N/A",1.0,false,"#N/A",false,false,false,false,"#N/A",false,false,false,false,true,false,false,false,Tabs,Click,false,false,false,List,"#N/A",true,"#N/A",false,"#N/A","#N/A",List,Hardware,"#N/A","#N/A","#N/A",One-time,"#N/A",false,"#N/A","#N/A","#N/A"
761386db-6111-4dfa-8dbb-f713551f877a,Our certified Integration Specialist Engineers bring a wealth of application expertise and integration experience to ensure the clients other systems are connected.,"#N/A","#N/A",Services,true,Integration Specialist Engineer,SV-ISE,"#N/A",Default,One per quote line,"#N/A","#N/A","#N/A",Quantity,One-Time,false,"#N/A","#N/A","#N/A","#N/A","#N/A","#N/A","#N/A","#N/A","#N/A",false,"#N/A",false,"#N/A","#N/A",1.0,false,"#N/A",false,false,false,false,"#N/A",false,false,false,false,false,false,true,false,"#N/A",Click,false,false,false,List,"#N/A",true,"#N/A",false,"#N/A","#N/A",List,"#N/A","#N/A","#N/A","#N/A",Renewable,"#N/A",false,"#N/A","#N/A","#N/A"
761cc30b-ffcd-4b62-849d-744feef3f376,Network Security Specialist for Atomic Security Suite Deployments,"#N/A","#N/A",Services,true,Network Security Specialist,SRVR-003,"#N/A",Default,"#N/A","#N/A","#N/A","#N/A",Quantity,One-Time,false,"#N/A","#N/A","#N/A","#N/A","#N/A","#N/A","#N/A","#N/A","#N/A",false,"#N/A",false,"#N/A","#N/A",1.0,false,"#N/A",false,false,false,false,"#N/A",false,false,false,false,false,false,false,false,"#N/A",Click,false,false,false,List,"#N/A",true,"#N/A",false,"#N/A","#N/A",List,"#N/A","#N/A","#N/A","#N/A",Renewable,"#N/A",false,"#N/A","#N/A","#N/A"
